{
  "collections": [
    {
      "id": "run-branch-protection-2026-09-08",
      "acquisition_transcript_ids": [
        "acq_3c9d5215283b500f3f22"
      ],
      "collector": {
        "name": "github-rest-api",
        "version": "2022-11-28",
        "collector": "evidence-spike/github-branch-protection"
      },
      "endpoint": "GET /repos/cyberwitchery/sbom-diff/branches/main/protection",
      "subject": {
        "kind": "repository",
        "id": "github:cyberwitchery/sbom-diff",
        "branch": "main"
      },
      "requested_scope": {
        "proposition": "branch_configuration",
        "branch": "main",
        "interval": {
          "from": "2026-09-08T00:00:00Z",
          "until": "2026-09-09T00:00:00Z"
        }
      },
      "observed_scope": {
        "proposition": "branch_configuration",
        "branch": "main",
        "interval": {
          "from": "2026-09-08T00:00:00Z",
          "until": "2026-09-09T00:00:00Z"
        }
      },
      "enumeration": {
        "items_fetched": 1,
        "items_reported": 1,
        "pages_fetched": 1,
        "terminal_page_reached": true,
        "next_token_present": false
      },
      "outcome": "complete",
      "limitations": [],
      "authority": [
        "branch_configuration"
      ],
      "observation_ids": [
        "ev_14529134a38a58cd7689"
      ],
      "started_at": "2026-09-08T07:00:02Z",
      "completed_at": "2026-09-08T07:00:03Z"
    },
    {
      "id": "run-pr-reviews-2026-09-08",
      "acquisition_transcript_ids": [],
      "collector": {
        "name": "github-review-collector",
        "version": "0.1.0",
        "collector": "evidence-spike/github-pull-request-reviews"
      },
      "endpoint": "GET /repos/cyberwitchery/sbom-diff/pulls + reviews",
      "subject": {
        "kind": "repository",
        "id": "github:cyberwitchery/sbom-diff"
      },
      "requested_scope": {
        "proposition": "pull_request_reviews",
        "branch": "main",
        "interval": {
          "from": "2026-08-17T00:00:00Z",
          "until": "2026-09-08T00:00:00Z"
        }
      },
      "enumeration": {
        "items_fetched": 0,
        "pages_fetched": 0,
        "terminal_page_reached": false,
        "next_token_present": false
      },
      "outcome": "not_attempted",
      "limitations": [
        {
          "kind": "not_attempted",
          "detail": "pull-request review collection is not configured"
        }
      ],
      "authority": [
        "pull_request_reviews"
      ],
      "observation_ids": [],
      "started_at": "2026-09-08T07:01:00Z",
      "completed_at": "2026-09-08T07:01:00Z"
    }
  ],
  "observations": [
    {
      "claim_key": "github:branch-protection:main",
      "collection_run_id": "run-branch-protection-2026-09-08",
      "data": {
        "allows_deletions": false,
        "allows_force_pushes": false,
        "dismisses_stale_reviews": true,
        "enforces_admins": false,
        "required_approving_review_count": 1,
        "required_status_checks": [],
        "requires_code_owner_reviews": false,
        "requires_last_push_approval": false,
        "requires_strict_status_checks": false
      },
      "evidence_class": "configured_intent",
      "id": "ev_14529134a38a58cd7689",
      "kind": "configuration_snapshot",
      "observed_at": "2026-09-08T07:00:02Z",
      "producer": {
        "name": "github-rest-api",
        "version": "2022-11-28",
        "collector": "evidence-spike/github-branch-protection"
      },
      "provenance": {
        "pointer": "",
        "source_id": "src_7e468a2204eb03855836"
      },
      "subject": {
        "kind": "repository",
        "id": "github:cyberwitchery/sbom-diff",
        "branch": "main",
        "revision": "a32c3a774b993b0216150cf7706b14cc6f107ea1"
      }
    },
    {
      "claim_key": "sbom-diff:dependency-change",
      "data": {
        "components": {
          "added": [
            "pkg:cargo/core-foundation-sys@0.8.7"
          ],
          "changed": [],
          "removed": []
        },
        "counts": {
          "added": 1,
          "changed": 0,
          "dependency_edges_changed": 3,
          "new_total": 104,
          "old_total": 103,
          "removed": 0,
          "unchanged": 103
        },
        "metadata_changed": {
          "timestamp": [
            "2026-08-17T14:10:49.796558154Z",
            "2026-09-07T07:03:48.995868000Z"
          ],
          "tools": [
            [
              "CycloneDX cargo-cyclonedx 0.5.9"
            ],
            [
              "CycloneDX cargo-cyclonedx 0.5.7"
            ]
          ]
        }
      },
      "evidence_class": "observed_state",
      "id": "ev_422c2b1b45fee34763b0",
      "kind": "change_set",
      "observed_at": "2026-09-07T07:12:00Z",
      "producer": {
        "name": "sbom-diff",
        "version": "0.8.0",
        "collector": "evidence-spike/sbom-diff"
      },
      "provenance": {
        "pointer": "",
        "source_id": "src_dbe77740e4e0be914e05"
      },
      "subject": {
        "kind": "release",
        "id": "github:cyberwitchery/sbom-diff:snapshot-b47cb5f",
        "base_revision": "94a1942b16f620a8c2ce292d292dd47c542e6d7e",
        "release": "snapshot-b47cb5f",
        "repository": "github:cyberwitchery/sbom-diff",
        "revision": "b47cb5f441416ff4adbe7a7287190fcf8c3e4531"
      }
    },
    {
      "claim_key": "supply-chain-gate:supply-chain/default",
      "execution_transcript_ids": [
        "exec_b2b9edbcacceb5c8488c"
      ],
      "data": {
        "base_revision": "58f7a9bce73b85325d6351a1c49e93cc9cc27211",
        "evaluated_sbom_diff_sha256": "106216ade137ac8ee25b75dad2e62cce4b4de7e747b3371f24e507d80a21f44d",
        "policy_id": "supply-chain/default",
        "target_revision": "94a1942b16f620a8c2ce292d292dd47c542e6d7e",
        "violations": []
      },
      "evidence_class": "observed_operation",
      "id": "ev_5afd491253be1f01e3e7",
      "kind": "policy_check",
      "observed_at": "2026-09-08T10:39:42.321646Z",
      "producer": {
        "name": "sbom-diff",
        "version": "0.8.0",
        "collector": "divinate/supply-chain-gate"
      },
      "provenance": {
        "pointer": "/execution",
        "source_id": "src_60a7278211c8ea507b5a"
      },
      "status": "pass",
      "subject": {
        "kind": "release",
        "id": "github:cyberwitchery/sbom-diff:v0.8.0",
        "base_release": "v0.7.0",
        "base_revision": "58f7a9bce73b85325d6351a1c49e93cc9cc27211",
        "release": "v0.8.0",
        "repository": "github:cyberwitchery/sbom-diff",
        "revision": "94a1942b16f620a8c2ce292d292dd47c542e6d7e"
      }
    },
    {
      "claim_key": "sbom-diff:dependency-change",
      "execution_transcript_ids": [
        "exec_0b7c1b80cd012fdb3cf7"
      ],
      "data": {
        "components": {
          "added": [],
          "changed": [
            "pkg:cargo/sbom-diff@0.8.0?download_url=file:%2F%2F.",
            "pkg:cargo/sbom-diff@0.8.0?download_url=file:%2F%2F.#src/lib.rs",
            "pkg:cargo/sbom-diff@0.8.0?download_url=file:%2F%2F.#src/main.rs",
            "pkg:cargo/sbom-model-cyclonedx@0.8.0?download_url=file:%2F%2F..%2Fsbom-model-cyclonedx",
            "pkg:cargo/sbom-model-spdx@0.8.0?download_url=file:%2F%2F..%2Fsbom-model-spdx",
            "pkg:cargo/sbom-model@0.8.0?download_url=file:%2F%2F..%2Fsbom-model",
            "pkg:cargo/thiserror-impl@2.0.20",
            "pkg:cargo/thiserror@2.0.20"
          ],
          "removed": []
        },
        "counts": {
          "added": 0,
          "changed": 8,
          "dependency_edges_changed": 0,
          "new_total": 103,
          "old_total": 103,
          "removed": 0,
          "unchanged": 95
        },
        "metadata_changed": {
          "timestamp": [
            "2026-08-07T22:20:15.652978387Z",
            "2026-08-17T14:10:49.796558154Z"
          ]
        }
      },
      "evidence_class": "observed_state",
      "id": "ev_5bae899c7ca922d9a0f5",
      "kind": "change_set",
      "observed_at": "2026-09-08T09:31:59.78435Z",
      "producer": {
        "name": "sbom-diff",
        "version": "0.8.0",
        "collector": "divinate/sbom-diff"
      },
      "provenance": {
        "pointer": "",
        "source_id": "src_106216ade137ac8ee25b"
      },
      "subject": {
        "kind": "release",
        "id": "github:cyberwitchery/sbom-diff:v0.8.0",
        "base_release": "v0.7.0",
        "base_revision": "58f7a9bce73b85325d6351a1c49e93cc9cc27211",
        "release": "v0.8.0",
        "repository": "github:cyberwitchery/sbom-diff",
        "revision": "94a1942b16f620a8c2ce292d292dd47c542e6d7e"
      }
    },
    {
      "claim_key": "supply-chain-gate:supply-chain/default",
      "execution_transcript_ids": [
        "exec_d6d131436248e44820e4"
      ],
      "data": {
        "base_revision": "58f7a9bce73b85325d6351a1c49e93cc9cc27211",
        "evaluated_sbom_diff_sha256": "106216ade137ac8ee25b75dad2e62cce4b4de7e747b3371f24e507d80a21f44d",
        "policy_id": "supply-chain/default",
        "target_revision": "94a1942b16f620a8c2ce292d292dd47c542e6d7e",
        "violations": []
      },
      "evidence_class": "observed_operation",
      "id": "ev_5e9a7645715dac4c275d",
      "kind": "policy_check",
      "observed_at": "2026-09-08T09:31:59.78435Z",
      "producer": {
        "name": "sbom-diff",
        "version": "0.8.0",
        "collector": "divinate/supply-chain-gate"
      },
      "provenance": {
        "pointer": "/execution",
        "source_id": "src_ff37b95ac29a1c98cd8f"
      },
      "status": "pass",
      "subject": {
        "kind": "release",
        "id": "github:cyberwitchery/sbom-diff:v0.8.0",
        "base_release": "v0.7.0",
        "base_revision": "58f7a9bce73b85325d6351a1c49e93cc9cc27211",
        "release": "v0.8.0",
        "repository": "github:cyberwitchery/sbom-diff",
        "revision": "94a1942b16f620a8c2ce292d292dd47c542e6d7e"
      }